{
  "protocolVersion": "1",
  "projectId": "test-project",
  "jobId": "test-job",
  "inputRevision": 1,
  "settings": {
    "thickness": 0.2,
    "margin": 5,
    "compensation": 0,
    "mirror": false,
    "design": {
      "kind": "stencil",
      "frame": "bounds",
      "extraLeft": 0,
      "extraRight": 0,
      "extraTop": 0,
      "extraBottom": 0,
      "cornerStyle": "round",
      "cornerTL": 0,
      "cornerTR": 0,
      "cornerBL": 0,
      "cornerBR": 0,
      "boardThickness": 1.6,
      "clearance": 0.2,
      "floor": 1,
      "slotWidth": 0,
      "chamfer": 0,
      "optimization": {
        "scale": 100,
        "rounding": 0,
        "grid": false,
        "gridThreshold": 2,
        "gridCell": 1,
        "gridWeb": 0.4,
        "stagger": false,
        "gap": 0.55,
        "staggerOffset": 15,
        "staggerShrink": 10,
        "taper": 100
      },
      "cornerStyles": {
        "TL": "round",
        "TR": "round",
        "BL": "round",
        "BR": "round"
      }
    }
  },
  "ir": {
    "schemaVersion": "2",
    "unit": "mm",
    "source": {
      "originalUnit": "MM",
      "zeroSuppression": "L"
    },
    "apertures": [
      {
        "code": 10,
        "shape": {
          "type": "rectangle",
          "width": 2,
          "height": 1
        }
      }
    ],
    "objects": [
      {
        "kind": "flash",
        "polarity": "dark",
        "aperture": 10,
        "at": {
          "x": 0,
          "y": 0
        },
        "sourceOffset": 0
      },
      {
        "kind": "flash",
        "polarity": "dark",
        "aperture": 10,
        "at": {
          "x": 6,
          "y": 4
        },
        "sourceOffset": 1
      }
    ]
  },
  "edits": [
    {
      "id": "0:0:0",
      "dx": 0,
      "dy": 0,
      "scaleX": 1,
      "scaleY": 1,
      "rotation": 0,
      "compensation": 0,
      "deleted": false,
      "optimization": {
        "scale": 100,
        "rounding": 0,
        "grid": false,
        "gridThreshold": 2,
        "gridCell": 1,
        "gridWeb": 0.4,
        "stagger": false,
        "gap": 0.55,
        "staggerOffset": 15,
        "staggerShrink": 10,
        "taper": 100,
        "xyMode": "upper",
        "xyScaleX": 80,
        "xyScaleY": 120
      }
    }
  ]
}
